{
  "schemaVersion": 1,
  "worldId": "tokyo-urban",
  "acquiredAt": "2026-08-26T13:00:00Z",
  "licence": {
    "id": "ODbL-1.0",
    "uri": "https://opendatacommons.org/licenses/odbl/1-0/",
    "evidenceFilename": "odbl-1.0.html",
    "evidenceSha256": "b8d8aebb21bf405f93f6e21bbf0d8f0a749844f9812ec58692f189add6402b47",
    "attribution": "Copyright OpenStreetMap contributors. Data available under the Open Database License 1.0.",
    "retentionAllowed": true,
    "derivativesAllowed": true,
    "redistribution": "allowed",
    "publicUseObligations": [
      "attribute-OpenStreetMap-contributors",
      "link-to-ODbL-1.0",
      "offer-derived-database-under-ODbL-1.0",
      "keep-technical-measures-from-restricting-parallel-access"
    ],
    "thirdPartyRights": "OpenStreetMap contributors retain rights in contributed contents; the OpenStreetMap Foundation licenses the database under ODbL 1.0, which does not itself license independent rights in individual contents.",
    "decision": "admit",
    "decisionReason": "ODbL 1.0 permits retention, adaptation, and public redistribution when attribution, notice, and share-alike obligations are preserved. The compiled World Pack retains exact queries and source responses and declares the ODbL obligations."
  },
  "assets": [
    {
      "logicalName": "osm-tokyo-buildings-south",
      "filename": "tokyo-building-south.json",
      "sourceUri": "https://overpass-api.de/api/interpreter?data=%5Bout%3Ajson%5D%5Btimeout%3A180%5D%3Bway%5Bbuilding%5D%2835.6155%2C139.7440%2C35.6463%2C139.8110%29%3Bout%20geom%2835.6155%2C139.7440%2C35.6463%2C139.8110%29%20qt%3B",
      "sourceVersion": "osm-base:2026-08-26T12:51:52Z;query-sha256:4fbe4024af94363083ccb996031bc454d3e215b1fefc9960441e146b5af3c90c",
      "sha256": "a74ff0f63b7d02259fdc63c772ad7a2daa84b355f7f23209cd6a35d009d9c7cd",
      "byteSize": 1900825,
      "mediaType": "application/json",
      "formatVersion": "Overpass-JSON-0.6",
      "evidenceClass": "recorded",
      "sourceDate": "2026-08-26T12:51:52Z",
      "adapter": "overpass-query",
      "adapterVersion": "1"
    },
    {
      "logicalName": "osm-tokyo-buildings-middle",
      "filename": "tokyo-building-middle.json",
      "sourceUri": "https://overpass-api.de/api/interpreter?data=%5Bout%3Ajson%5D%5Btimeout%3A180%5D%3Bway%5Bbuilding%5D%2835.6463%2C139.7440%2C35.6772%2C139.8110%29%3Bout%20geom%2835.6463%2C139.7440%2C35.6772%2C139.8110%29%20qt%3B",
      "sourceVersion": "osm-base:2026-08-26T12:51:52Z;query-sha256:0c6df0e3fdbaf5a20c683d97fa3115297cc8e9e7974907dda905424cf912cb58",
      "sha256": "f22f962665eda4714a3de3064cc590f20a6a99bf5366669bf0c03a7a08a6f55b",
      "byteSize": 13337983,
      "mediaType": "application/json",
      "formatVersion": "Overpass-JSON-0.6",
      "evidenceClass": "recorded",
      "sourceDate": "2026-08-26T12:51:52Z",
      "adapter": "overpass-query",
      "adapterVersion": "1"
    },
    {
      "logicalName": "osm-tokyo-buildings-north",
      "filename": "tokyo-building-north.json",
      "sourceUri": "https://overpass-api.de/api/interpreter?data=%5Bout%3Ajson%5D%5Btimeout%3A180%5D%3Bway%5Bbuilding%5D%2835.6772%2C139.7440%2C35.7080%2C139.8110%29%3Bout%20geom%2835.6772%2C139.7440%2C35.7080%2C139.8110%29%20qt%3B",
      "sourceVersion": "osm-base:2026-08-26T12:53:55Z;query-sha256:f5bfa2e6e89a563b1adf50223687d2c809e3330e4ffdea2515dea0294237aeaa",
      "sha256": "92c5ec67fb12a76986aa10c5d875fb2a602f549b958776c81b72c66b8171a0bb",
      "byteSize": 31558960,
      "mediaType": "application/json",
      "formatVersion": "Overpass-JSON-0.6",
      "evidenceClass": "recorded",
      "sourceDate": "2026-08-26T12:53:55Z",
      "adapter": "overpass-query",
      "adapterVersion": "1"
    },
    {
      "logicalName": "osm-tokyo-highways-south-1",
      "filename": "tokyo-highway-south-1.json",
      "sourceUri": "https://overpass-api.de/api/interpreter?data=%5Bout%3Ajson%5D%5Btimeout%3A180%5D%3Bway%5Bhighway%5D%2835.6155%2C139.7440%2C35.6309%2C139.8110%29%3Bout%20geom%2835.6155%2C139.7440%2C35.6309%2C139.8110%29%20qt%3B",
      "sourceVersion": "osm-base:2026-08-26T12:54:57Z;query-sha256:2b1866e54172d696dd838966beceedaf8977ef25126c3e51032de3953122ca77",
      "sha256": "d170de32d6544ba886ccb7337b98053d3fbbffa88c8379cab5e4b0502b1abe97",
      "byteSize": 1497674,
      "mediaType": "application/json",
      "formatVersion": "Overpass-JSON-0.6",
      "evidenceClass": "recorded",
      "sourceDate": "2026-08-26T12:54:57Z",
      "adapter": "overpass-query",
      "adapterVersion": "1"
    },
    {
      "logicalName": "osm-tokyo-highways-south-2",
      "filename": "tokyo-highway-south-2.json",
      "sourceUri": "https://overpass-api.de/api/interpreter?data=%5Bout%3Ajson%5D%5Btimeout%3A180%5D%3Bway%5Bhighway%5D%2835.6309%2C139.7440%2C35.6463%2C139.8110%29%3Bout%20geom%2835.6309%2C139.7440%2C35.6463%2C139.8110%29%20qt%3B",
      "sourceVersion": "osm-base:2026-08-26T12:54:57Z;query-sha256:acfc15a2e9d99e42efe44d9528b1038c62be1e50537f2e1ff525a201cf83f384",
      "sha256": "a1a3cab60eb9f2c02bc7e37fc1bcc791a820a5d64a5d159d261da8da2455f30e",
      "byteSize": 1647141,
      "mediaType": "application/json",
      "formatVersion": "Overpass-JSON-0.6",
      "evidenceClass": "recorded",
      "sourceDate": "2026-08-26T12:54:57Z",
      "adapter": "overpass-query",
      "adapterVersion": "1"
    },
    {
      "logicalName": "osm-tokyo-highways-middle",
      "filename": "tokyo-highway-middle.json",
      "sourceUri": "https://overpass-api.de/api/interpreter?data=%5Bout%3Ajson%5D%5Btimeout%3A180%5D%3Bway%5Bhighway%5D%2835.6463%2C139.7440%2C35.6772%2C139.8110%29%3Bout%20geom%2835.6463%2C139.7440%2C35.6772%2C139.8110%29%20qt%3B",
      "sourceVersion": "osm-base:2026-08-26T12:54:57Z;query-sha256:ddd1732e4dcb49dd3fbbd88a2d98867406298eecbb8952e29b8bf732b74b69c0",
      "sha256": "ef2c3cf8dc257434131fce5bf27aef72f9e1c20cf32eefae9a5e015be5055195",
      "byteSize": 8874313,
      "mediaType": "application/json",
      "formatVersion": "Overpass-JSON-0.6",
      "evidenceClass": "recorded",
      "sourceDate": "2026-08-26T12:54:57Z",
      "adapter": "overpass-query",
      "adapterVersion": "1"
    },
    {
      "logicalName": "osm-tokyo-highways-north",
      "filename": "tokyo-highway-north-nodes.json",
      "sourceUri": "https://overpass-api.de/api/interpreter?data=%5Bout%3Ajson%5D%5Btimeout%3A180%5D%3Bway%5Bhighway%5D%2835.6772%2C139.7440%2C35.7080%2C139.8110%29%3Bout%20body%3B%3E%3Bout%20skel%20qt%3B",
      "sourceVersion": "osm-base:2026-08-26T12:58:03Z;query-sha256:b70928fee0c271e32615463f2ce2f1152cfaddd89982ae8a10960d39476f2089",
      "sha256": "64f1eef58e0ab997b774bf5e8168ac4ae91bf6cc44b88938bd549bc4b247ac92",
      "byteSize": 10102043,
      "mediaType": "application/json",
      "formatVersion": "Overpass-JSON-0.6",
      "evidenceClass": "recorded",
      "sourceDate": "2026-08-26T12:58:03Z",
      "adapter": "overpass-query",
      "adapterVersion": "1"
    }
  ]
}
